{
  "schemaVersion": "cautilus.scenario_proposal_inputs.v1",
  "windowDays": 14,
  "families": [
    "fast_regression"
  ],
  "proposalCandidates": [
    {
      "proposalKey": "review-after-retro",
      "title": "Refresh review-after-retro scenario from recent activity",
      "family": "fast_regression",
      "intentProfile": {
        "schemaVersion": "cautilus.behavior_intent.v1",
        "intentId": "intent-review-after-retro",
        "summary": "The workflow should support pivoting from retro back to review in one thread.",
        "behaviorSurface": "conversation_continuity",
        "successDimensions": [
          {
            "id": "workflow_continuity",
            "summary": "Carry the active workflow context cleanly into the next turn."
          }
        ],
        "guardrailDimensions": []
      },
      "name": "Review After Retro",
      "description": "The user pivots from retro back to review in one thread.",
      "brief": "Recent activity shows a retro turn followed by a review turn.",
      "simulatorTurns": [
        "retro 먼저 해주세요",
        "이제 review로 돌아가죠"
      ],
      "evidence": [
        {
          "sourceKind": "human_conversation",
          "origin": "real",
          "title": "review after retro",
          "threadKey": "thread-1",
          "observedAt": "2026-04-09T21:00:00.000Z",
          "activityProvenance": {
            "activityId": "session-thread-1",
            "taskKey": "review-after-retro",
            "recurrenceKey": "review-after-retro",
            "split": "proposal"
          },
          "messages": [
            "retro 먼저 해주세요",
            "이제 review로 돌아가죠"
          ]
        },
        {
          "sourceKind": "agent_run",
          "origin": "replayed",
          "title": "review-after-retro replay passed",
          "runId": "replay-run-1",
          "threadKey": "thread-1",
          "observedAt": "2026-04-10T21:00:00.000Z",
          "activityProvenance": {
            "activityId": "session-thread-1",
            "taskKey": "review-after-retro",
            "recurrenceKey": "review-after-retro",
            "replayId": "replay-1",
            "split": "review",
            "score": 0.82
          },
          "textPreview": "Replay confirmed the retro-to-review pivot remains relevant."
        },
        {
          "sourceKind": "skill_evaluation",
          "origin": "synthetic",
          "title": "synthetic review pivot seed",
          "targetKind": "public_skill",
          "targetId": "cautilus-agent",
          "surface": "proposal_seed",
          "observedAt": "2026-04-08T21:00:00.000Z",
          "activityProvenance": {
            "activityId": "synthetic-review-after-retro-1",
            "taskKey": "review-after-retro",
            "split": "train"
          },
          "summary": "Synthetic seed covers the same operator pivot without entering held-out or acceptance evidence."
        },
        {
          "sourceKind": "human_conversation",
          "origin": "operator_authored",
          "title": "operator-authored review pivot note",
          "threadKey": "operator-note-1",
          "observedAt": "2026-04-07T21:00:00.000Z",
          "activityProvenance": {
            "activityId": "operator-note-1",
            "taskKey": "review-after-retro",
            "split": "proposal"
          },
          "messages": [
            "Operators expect retro-to-review context to survive in one thread."
          ]
        }
      ]
    }
  ],
  "existingScenarioRegistry": [
    {
      "scenarioId": "review-after-retro",
      "scenarioKey": "review-after-retro",
      "family": "fast_regression"
    }
  ],
  "scenarioCoverage": [
    {
      "scenarioKey": "review-after-retro",
      "recentResultCount": 2
    }
  ],
  "now": "2026-04-11T00:00:00.000Z"
}
